"flag","content"
"$CAPTAINRAY_INTRODUCTION_01","Bienvenue [color=#4a52e1]à bord[/color]. On dirait que c'est votre [instant=100]première partie[/instant]. (Appuyez sur Entrée pour continuer)"
"$CAPTAINRAY_INTRODUCTION_02","Voulez-vous suivre un bref tutoriel ? Utilisez les touches gauche et droite pour choisir, puis appuyez sur Entrée."
"$LETTER_FOUND","Vous avez [color=yellow]trouvé[/color] une [color=blue]lettre[/color] !"
"$EVACUATION_EVACUATE","TOUS ÉVACUER LE NAVIRE"
"$EVACUATION_GATHER_NOTES","{player}, veuillez rassembler toutes les notes autour du navire pour obtenir le code d'évasion. Vous avez 10 minutes."
